383;483;बड़ा कोष्ठक चिह्न;मार्गशीर्षी;एक प्रकार का कोष्ठक चिन्ह जो सबसे बाहर लगाते हैं;मार्गशीर्ष महिन्यासंबंधी किंवा मार्गशीर्षातील; [()], इसमें बाहरी कोष्टक, बड़ा कोष्टक चिन्ह है; ती मार्गशीर्षी पौर्णिमेला उपवास धरते.
384;484;फिरकी;येशू ख्रिस्त;खूब घूमनेवाला काठ आदि का एक गोल छोटा खिलौना;ख्रिस्तीधर्माचा संस्थापक; बच्चा फिरकी नचा रहा है; येशू ख्रिस्तांना बेबंदशाही राजा ने सुळावर चढवले
385;485;पतन;ख्रिस्ती;जाति, राष्ट्र आदि का ऐसी स्थिति में आना कि उसकी प्रभुता नष्ट होने लगे और महत्ता कम हो जाय;ख्रिस्ती धर्माचा अनुयायी; भारतीय राज्यों के पतन का कारण मुगलों का आक्रमण था; ख्रिस्ती येशू ख्रिस्ताला आपला प्रेषित मानतात
386;486;गति मापक;ईसाविषयक;वह यंत्र जिससे किसी चलने वाली वस्तु आदि की गति नापी जाती है;ईसाशी संबंधीत; इस वाहन का गति मापक काम नहीं कर रहा है; हे ईसाविषयक गोष्टींचे पुस्तक आहे.
387;487;तत्त्व;पाद्री;जगत का मूल कारण;ख्रिस्ती धर्माचे धर्मोपदेशक; सांख्य दर्शन के अनुसार तत्त्वों की संख्या पच्चीस बताई गई है; फादर स्टीफन्स हे पाद्री होते
388;488;मझला कोष्ठक;बटण;एक प्रकार का कोष्ठक चिन्ह जो आवश्यकता पड़ने पर छोटे कोष्ठक के बाहर लगाया जाता है;अंगरखा किंवा कोटाला लागणारी गोल आकाराची गोळी; कोष्टकवाले प्रश्न में मझला कोष्ठक हटाने के बाद छोटा कोष्ठक हटाया जाता है; त्याच्या कोटाला सोनेरी रंगाचे बटण लागले आहे.
389;489;छोटा कोष्ठक;कॉलर;कोष्ठक चिह्न का एक प्रकार जो छोटा होता है और जिसका प्रयोग अन्य कोष्टकों से अधिक किया जाता है;गळ्याच्या भोवती असलेली शर्ट किंवा कोटाची पट्टी; (आम), यहाँ छोटे कोष्टक के बीच में आम लिखा गया है; कुरत्याच्या कॉलरवर वेलबुट्टी सुंदर दिसत होती
390;490;जन्तु ऊतक;वस्त्र भाग;जन्तु शरीर में पाये जानेवाले ऊतक;परिधान करणाऱ्या कपड्याचा एखादा भाग; जन्तु ऊतक कई प्रकार के होते हैं; अस्तनी हा वस्त्र भाग आहे.
391;491;वनस्पति ऊतक;हात;वह ऊतक जो वनस्पतियों में पाया जाता है;मनुष्याच्या शरीरातील खांद्यापासून पंजापर्यंतचा भाग; विज्ञान की घंटी में बच्चों को वनस्पति ऊतक के बारे में जानकारी दी गयी; रावणाला दहा तोंडे आणि वीस हात होते असे म्हणतात.
392;492;सुषिर वाद्य;पोशाख;वह वाद्य जो हवा के दबाव या जोर से बजता हो;घालण्याचे कापड; बाँसुरी एक सुषिर वाद्य है; तिचा पोशाख आकर्षक होता./ त्या मालिकातील पात्रांचा कपडेपट एवढा अभ्यास करून बनवला जात असेल का?
393;493;छोटी बाँसुरी;ईश्वरी;एक प्रकार की बाँसुरी जो आकार में छोटी होती है;ईश्वरासंबंधीचा; पंडित हरिप्रसाद चौरसिया ने छोटी बाँसुरी बजाकर सबका दिल जीत लिया; त्याचा ईश्वरी शक्तीवर विश्वास आहे.
394;494;नकवंशी;प्रेरणादायक;नाक से बजायी जाने वाली एक प्रकार की बाँसुरी जो कुछ एशियाई देशों में बजायी जाती है;प्रेरणा देणारे; वह नकवंशी बजाने में निपुण है; गुरुजींचे भाषण खूप प्रेरणादायक होते
395;495;वाद्ययंत्र;किनार;वह यंत्र जिससे संगीत के स्वर निकलते या ताल दिये जाते हैं;एखाद्या वस्तूचा लांबी व रुंदी संपलेला शेवटचा भाग; इस संगीत विद्यालय में हर प्रकार के वाद्ययंत्र हैं; या ताटाची किनार फारच पातळ आहे
396;496;मापक;धर्मप्रवर्तक;वह साधन जिससे कुछ मापा जाए;धर्माचे प्रवर्तन करणारी व्यक्ती; यह एक लीटर का मापक है; बुद्ध हे एक महान धर्मप्रवर्तक होते
397;497;थाप वाद्य;प्रवर्तक;वह वाद्य जो चमड़े से मढ़ा हुआ हो;एखादे काम आरंभ करणारा; ढोल एक थाप वाद्य है; जैन धर्माचे प्रवर्तक महावीर स्वामी आहेत
398;498;घनवाद्य;टाळी;वह वाद्य जिसके दोनों भागों को एक दूसरे पर अघात करके बजाया जाता है ;दोन्ही हातांनी एकामेकांवर मारण्याची क्रिया; मँजीरा एक ताल वाद्य है; भाषण संपल्यावर प्रेक्षकांनी टाळ्या वाजवल्या.
399;499;तंतु वाद्य;रांजणवाडी;वह वाद्य जिसमें बजाने के लिए तार लगे रहते हैं;डोळ्याच्या पापणीला होणारी पुळी; सारंगी एक तंतु वाद्य है; रांजणवाडी झाल्यास लसूण लावतात.
400;500;मृदंग;प्रद्युम्न;ढोल की तरह का एक पुराना आनद्ध वाद्य;कृष्णाचा थोरला मुलगा; मृदंग की ताल पर वह थिरक उठा; प्रद्युम्न हा कामदेवाचा अवतार होता
401;501;तबला;उल्काश्म;ताल देने का एक वाद्य, जिसमें दो बाजे एक साथ बजते हैं;खडकाच्या स्वरूपात पृथ्वीवर पडलेली उल्का; जब उस्ताद ज़ाकिर हुसैन की अंगुलियाँ तबले पर थिरकने लगती हैं तो श्रोता वाह-वाह कह उठता है; काही उल्काश्म केवळ धातुमय असतात तर काही वाळूचे बनलेले असतात
402;502;बीन;सर्वांग;तूँबी से बना एक बाजा जिसे सँपेरे बजाते हैं;एखाद्या वस्तुचे वा प्राण्याच्या शरीराचे सर्व अवयव; सँपेरे के बीन बजाते ही साँप अपना सिर हिलाने लगा; या संस्थेच्या सर्वांगात भ्रष्टाचार पसरला आहे/पोहण्याने सर्वांगाचा व्यायाम होतो
403;503;वायलिन;शारीरिक बाह्य अवयव;सारंगी की तरह का एक बाजा;सजीवाच्या शरीराचा बाहेरील भाग जो उघड्या डोळ्यांनी दिसतो; भास्कर वायलिन बजाने में निपुण है; हात एक शारीरिक बाह्य अवयव आहे.
404;504;झाँझ;मनगट;मँजीरे की तरह का गोलाकार धातु के टुकड़ों का जोड़ा जो पूजन आदि के समय बजाया जाता है;हाताचा पंज्याचा सांधा; कीर्तन में कई जोड़े झाँझ बज रहे थे; मनगट बारीक असल्यामुळे तिला बांगड्या घालायला त्रास होत नाही
405;505;सारंगी;कोपर;एक बाजा जिसमें लगे हुए तार कमानी से रेतकर बजाए जाते हैं;भुजा आणि हात यांच्या मधल्या सांध्याचे मागील टोक; योगी सारंगी बजाने में मस्त था; कोपरात असलेल्या हाडाला इंग्रजीत फनी बोन असे म्हणतात
406;506;सितार;लिग्नाइट;एक तंतु वाद्य जिसमें कई सारे तार लगे होते हैं;सामान्यपणे दगडी कोळशापेक्षा कमी घट्ट आणि कठीण असणारा कोळशाचा प्रकार; दीपक सितार बजाने में निपुण है; लिग्नाइट वाळल्यावर त्याचा सहज भुगा होतो
407;507;वीणा;लोणारी कोळसा;एक बाजा जो सब बाजों में श्रेष्ठ माना गया है;लाकडाचे तुकडे मातीच्या घागरीत भरून अर्धवट जाळल्यामुळे तयार होणारा इंधन म्हणून वापरता येणारा पदार्थ; शीला वीणा बजाने में निपुण है; त्याने शेगडीत आणखी लोणारी कोळसे घातले
408;508;नरसिंहा;दगडी कोळसा;तुरही की तरह का एक बड़ा बाजा;खाणीतून निघणारा कोळसा, हजारो वर्षांपूर्वी पृथ्वीवरील अरण्ये व वनस्पती भूकंपादी कारणाने भूगर्भात गाडल्या गेल्यावर त्यांच्यावर अनेक रासायनिक क्रिया होऊन त्यापासून हा कोळसा बनतो; नरसिंहा की आवाज़ दूर-दूर तक सुनाई देती है; ह्या भागात दगडी कोळशाच्या खाणी आहेत
409;509;तानपूरा;चूर्ण;सितार की तरह का, पर उससे बड़ा, एक प्रकार का बाजा;एक प्रकारची औषधी पूड; मुझे तानपूरा बजाना अच्छा लगता है; आजी चूर्ण खाऊन त्यावर एक पेला पाणी प्यायली.
410;510;कबाब;वैकुंठ चतुर्दशी;सीकों पर भूनकर पकाया हुआ वह मांस जिसमें हड्डी नहीं होती है;कार्तिक शुक्ल चतुर्दशी; वह होटल में कबाब खाने गया है; हनुमानाचा जन्म वैकुंठ चतुर्दशीला झाला असे मानले जाते.
411;511;बायाँ;उल्का;तबले में एक साथ बजने वाले दो बाजे में से एक जो धातु या काठ पर चमड़ा मढ़कर बनाया जाता है;अवकाशातील धूळ आणि खडे ह्यांपासून बनलेली राशी; दाएँ की तुलना में बायाँ छोटा होता है   /  रवि ने तबला बजाते समय बायें  पर इतने ज़ोर से मारा कि वह फूट गया; येत्या अमावास्येला उल्कांचा वर्षाव पाहायला मिळेल
412;512;पूरी;आकाशगोल;मृदंग, तबले, ढोल आदि के मुख पर मढ़ा हुआ गोल चमड़ा;आकाशात दिसणारे किंवा खगोलातील तारे, ग्रह, नक्षत्र इत्यादी गोल; इस ढोल के दोनों ओर की पूरियाँ खराब हो गयी हैं; सूर्य हा एक आकाशगोल आहे.
413;513;ढक्का;उसासा;एक प्रकार का बड़ा ढोल;दुःखी किंवा उदास मनस्थितीत असताना घेतला जाणारा किंवा सोडला जाणारा दिर्घ श्वास; ईद के अवसर पर वह ढक्का बजा रहा था; रामूने उसासा टाकला आणि आपली कहाणी सांगू लागला.
414;514;चुसनी;उसासा;छोटे बच्चों के दूध की शीशी का ऊपर का भाग जो मुँह में डालकर वे चुबलाते हैं;उरातून खोलवरून वेगाने व आवाज करीत बाहेर पडणारा उच्छ्वास; चुसनी देखते ही बच्चे ने रोना बंद कर दिया; सर्व सांगून झाल्यावर त्याने एक उसासा टाकला
415;515;चूची;पडका;स्त्रियों या मादा पशुओं के स्तन का अग्र भाग जिससे दूध निकलता है;पडलेला वा कोसळलेला; इस गाय की एक चूची में घाव हो गया है; ते त्या पडक्या किल्ल्यात फिरत होते
416;516;अमीबा;निर्वासित;जल में पाया जानेवाला एक एक कोशकीय जन्तु;आपल्या वसतिस्थानापासून विस्थापित वा दुरावलेला; अमीबा दो भागों में विभाजित होकर एक नया अमीबा तैयार करता है; तो निर्वासित कुटुंबाचा सदस्य आहे.
417;517;मोटा;एक-दोन;फूले हुए या स्थूल शरीर वाला या अत्यधिक मांस वाला;खूपच कमी जसे एक किंवा दोन; सूमो पहलवान बहुत मोटे होते हैं   /  मोटे लोगों को हृदयरोग का खतरा अधिक होता है; रस्त्यावर एक दोन माणसेच होती.
418;518;एककोशीय जन्तु;मानवी;वह जन्तु जिसका शरीर मात्र एक कोशिका से बना होता है;मानवाचा वा मानवाशी संबंधित; अमीबा एककोशीय जन्तु है; ह्या गुहेत काही मानवी आकृत्या कोरल्या आहेत.
419;519;अकशेरुकी जंतु;स्थलांतरित;वह जंतु जिसमें कशेरुक दंड नहीं पाया जाता;एका स्थानावरुन दुसर्या स्थानावर हलवलेला; हाइड्रा एक अकशेरुकी जन्तु है; ती स्थलांतरित वस्तूंना पुनः त्यांच्या जागेवर ठेवत होती.
420;520;बकवासी;खोटारडा;बकवास करनेवाला या व्यर्थ की बातें बोलनेवाला;खोटे बोलणारा; रामू एक बकवासी व्यक्ति है; खोटारड्या माणसाची संगत टाळावी
421;521;बाम;ध्वज;साँप जैसी एक मछली;उंच स्तंभ उभारून त्यावर विशिष्ट चिन्हाने युक्त असे वस्त्र; मछुआरे के जाल में एक बाम भी फँस गई; राजादिकांच्या स्वारीपुढे असलेला ध्वज म्हणजे त्यांचे यशचिन्ह होय
422;522;पैर;अप्राप्य;वह अंग जिससे प्राणी खड़े होते और चलते-फिरते हैं;जे प्राप्त झालेले नाही किंवा प्राप्त होणे कठीण आहे असे; मेरे पैर में दर्द है; कष्टाळू व्यक्तिला जगात काहीच अप्राप्य नसते.
423;523;पागल कुत्ता;श्रमण;वह कुत्ता जो पागल हो गया हो;जैनधर्मीय साधू; उसको एक पागल कुत्ते ने काट लिया; श्रमण गृहत्याग करून उपाश्रयात राहतात
424;524;null;खूपच चांगले;null;चांगल्या प्रकारे;null; मी त्याला खूपच चांगले ओळखतो. / मी त्यांना बरोबर ओळखून आहे.
425;525;दूध;सत्यवचनी;वह सफेद तरल पदार्थ जो स्तनपायी जीवों की मादा के स्तनों से निकलता है;सत्य बोलणारी; बच्चों के लिए माँ का दूध सर्वोत्तम आहार है; माझी आई सत्यवचनी आहे.
426;526;शाकाहारी जंतु;खरेतर;वह जन्तु जो वनस्पति जन्य पदार्थों और अन्न आदि का सेवन करता है;खरे पाहता; गाय एक शाकाहारी जंतु है; वस्तुतः तिने मला ओळखलेच नाही./खरोखरच सरकारकडे ह्या योजनांसाठी पैसा आहे का?
427;527;कार्य अंतराल;गुळमुळीत;किसी कार्य के बीच में मिलनेवाला अंतराल;संदिग्धपणे; कार्य अंतराल में श्रमिक नेता ने श्रमिकों से विचार-विमर्श किया; तो नेहमीच गुळमुळीत बोलतो
428;528;पूरी;स्पष्टपणे;मृदंग, तबले, ढोल आदि के मुख पर मढ़े हुए चमड़े के ऊपर लगी हुई गोल काली टिक्की;कोणताही आडपडदा वा भीड न बाळगता; तबले की पूरी उधड़ गई है; तुला जे काही बोलायचे आहे ते स्पष्टपणे बोल
429;529;जलकण;असभ्यपणे;पानी की बूँद;असभ्य रीतीने; पद्म-पत्र पर छिटके जलकण सूर्य-प्रकाश में मोती से चमक रहे हैं; ती फारच असभ्यपणे वागली
430;530;मावा;स्वार्थी;दूध को गाढ़ा करने से बना ठोस रूप जिससे मिठाई बनाते हैं;नेहमी केवळ स्वतःचे हित पाहणारा; गुलाब-जामुन मावा से बनता है; त्या स्वार्थी माणासाने सर्वांचा विचार न करता आधी आपले पोट भरले.
431;531;मध्यांतर;प्राण;किसी खेल आदि के बीच में होनेवाला कुछ समय का अवकाश;शरीराचे चलनवलन करणारी शक्ती; खेल के मध्यांतर में मैं चाय पीने चला गया; माणूस मरतो म्हणजे त्याच्या शरीरातला प्राण निघून जातो
432;532;गुरुद्वारा;नायिका;सिक्खों का धर्मस्थान;काव्य,नाटक, कादंबरी, कथा यातील मुख्य स्त्री पात्र; गुरुपूर्णिमा के दिन गुरुद्वारे में लंगर था; नायिकेनेच आपल्या पोराला मारले, हे रहस्य नाटकाच्या शेवटी कळले
433;533;गाँधी जयंती;उपनायिका;महात्मा गाँधी का जन्मदिवस जो जयंती के रूप में मनाया जाता है;नाटकात किंवा काव्यात मुख्य नायिके बरोबर असलेली सहकारिणी; दो अक्टूबर को पूरे भारत में गाँधी जयंती धूम-धाम से मनायी जाती है; नाटकात त्या उपनायिके चे काम बघण्यासारखे होते
