242;342;वाद-विवाद करना;कांब;एक साथ बैठकर किसी मुद्दे आदि पर तर्क-वितर्क करना या उस मुद्दे पर सहमत न होना;बांबूच्या लहान लहान चिरफळ्या; राम और श्याम अनावश्यक मसले पर वाद-विवाद कर रहे हैं; बुरूड कांबेच्या टोपल्या विणतात
243;343;वितंडा करना;लोखंडी पिंजरा;व्यर्थ का वाद विवाद करना या कहा सुनी करना;लोखंडापासून बनविलेला पिंजरा; वह घर में बैठकर वितंडा कर रहा है; वाघ लोखंडी पिंजर्यात बंद आहे.
244;344;धमकाना;कांब;धमकी देते हुए डराना;लोखंडाची दांडी; एक लड़का मेरे छोटे भाई को धमका रहा था; कांब घालून त्याने तुंबलेली मोरी मोकळी केली
245;345;भावाभिव्यक्ति करना;लेखणी;किसी माध्यम से अपना भाव प्रकट करना;शाईने लिहिण्यासाठी वापरले जाणारे साधन; वह अपनी कविता के माध्यम से भावाभिव्यक्ति करता है; पूर्वी बोरूची लेखणी करीत
246;346;अभिव्यक्त करना;कागद;किसी बात आदि को व्यक्त करना;कापूस,चिंध्या,ताग इत्यादींच्या रांध्यापासून तयार केलेली सपाट पृष्ठभागाची पातळ वस्तू; उसने अपने विचारों को अभिव्यक्त किया; कागदाचा शोध लागण्यापूर्वी लोक लिहिण्यासाठी झाडाच्या साली किंवा पाने वापरीत
247;347;सत्यवादी;लेखन साहित्य;जो सत्य बोलता हो;लिखाणाच्या कामी उपयोगी पडणारे साधन; युधिष्ठिर एक सत्यवादी व्यक्ति थे; प्राचीन काळी मोर पंखाचा उपयोग लेखन साहित्य म्हणून केला जात असे.
248;348;विश्वसनीय;चित्रांकित;जिसका विश्वास किया जा सके या जिस पर विश्वास हो ;ज्यावर चित्र काढले आहे असा; श्याम विश्वसनीय व्यक्ति है; दालनात विविध प्रकारचे चित्रांकित पडदे लावले होते
249;349;काल्पनिक;ऐच्छिक;जो वास्तविक न हो;मर्जीवर असलेला; वह काल्पनिक बातें सबको सुनाता रहता है; सर्व कारभार ऐच्छिक आहे.
250;350;कच्चा लोहा;कार्यकारी;वह लोहा जिससे लोहे की अन्य चीजों का निर्माण किया जाता है और जिसमें अन्य धातुएँ भी मिली रहती हैं;मुख्य अधिकारी किंवा शासन ह्यांच्याशी संबंधित असलेला; वह कच्चे लोहे को आग पर तपा रहा है; माझे काका कार्यकारी अभियंता आहेत.
251;351;ढला लोहा;अत्यावश्यक;एक प्रकार की लोहे और कार्बन की मिश्रधातु जिसमें कार्बन की इतनी मात्रा होती है कि उसे पीटा नहीं बल्कि ढाला जाता है;अतिशय आवश्यक असणारा; ढले लोहे से अस्त्र-शस्त्र का निर्माण किया जाता है; संपातून अत्यावश्यक सेवांना वगळण्यात आले आहे
252;352;वंश नाम;मीन;किसी व्यक्ति के वास्तविक और मुख्य नाम के अंत में रहनेवाला वह शब्द जो उसके वंश,परिवार,वृत्ति आदि का सूचक होता है;ज्यात पूर्व भाद्रपद, उत्तर भाद्रपद आणि रेवती नक्षत्र आहे अशी बारा राशींपैकी अंतिम रास; मोहन अपने नाम के साथ वंश नाम नहीं लिखता है; त्याची रास मीन आहे.
253;353;उपनाम;कुंभ रास;किसी व्यक्ति,वस्तु आदि के वास्तविक नाम से भिन्न कोई दूसरा नाम जिससे वह प्रसिद्ध हो या पुकारा जाता हो;(ज्योतिष) बारा राशींपैकी अकरावी रास ज्यात धनिष्ठा नक्षत्राचा उत्तरार्ध, संपूर्ण शततारका आणि पूर्वाभाद्रपदा नक्षत्राचे पहिले तीन चरण येतात; कवि रामधारी सिंह अपने उपनाम दिनकर से प्रसिद्ध हैं   /  कुछ लोग अपने वास्तविक नाम की अपेक्षा उर्फ से ज्यादा प्रसिद्ध होते हैं; ह्या महिन्याच्या शेवटी सूर्य कुंभ राशीत प्रवेश करेल.
254;354;पूर्णांक;मकर रास;किसी परीक्षा आदि में अंकों की कुल संख्या जिसके आधार पर परीक्षार्थी को अंक मिलते हैं;बारा राशींपैकी दहावी रास ज्यात उत्तराषाढा नक्षत्राचे शेवटचे तीन चरण,संपूर्ण श्रवण नक्षत्र आणि धनिष्ठा नक्षत्राचे पहिले दोन चरण येतात; इस प्रश्न-पत्र का पूर्णांक सौ है; मला मकर राशीचे वार्षिक भविष्यफळ जाणून घ्यायचे आहे.
255;355;प्राप्तांक;धनू रास;किसी परीक्षा आदि में परीक्षार्थी द्वारा पूर्णांक में से प्राप्त अंक;बारा राशींपैकी नववी रास ज्यात संपूर्ण मूळ व पूर्वाषाढा नक्षत्र तसेच उत्तराषाढा नक्षत्राचे पहिले चरण असते; हिन्दी में मेरा प्राप्तांक सत्तर प्रतिशत है; हा महिना धनू रास असलेल्यांना लाभदायक आहे.
256;356;भिन्न संख्या;वृश्चिक रास;गणित में, इकाई से कुछ कम या उसका कोई भाग सूचित करने वाली कोई संख्या;बारा राशींपैकी आठवी रास ज्यात विशाखा नक्षत्राचे अंतिम चरण व संपूर्ण अनुराधा व ज्येष्ठा नक्षत्र आहेत; आज अध्यापक जी ने गृह कार्य के लिए भिन्न संख्या से संबंधित प्रश्न दिए हैं; वृश्चिक राशीचे चिह्न विंचू आहे.
257;357;हर;तूळ रास;गणित के अंतर्गत भिन्न संख्या में से नीचे वाली संख्या जो अपने आधार पर अंश को दर्शाती है;बारा राशींपैकी सातवी रास; किसी वस्तु के दो तिहाई में तीन हर है; तूळ राशीचे चिह्न तराजू आहे.
258;358;रोमन अंक;कन्या रास;रोमन भाषा का अंक;बारा राशींपैकीकी सहावी रास; इन संख्याओं को रोमन अंकों में लिखिये; हे वर्ष कन्या राशींच्या लोकांसाठी लाभदायक आहे.
259;359;लिपि;सिंह रास;चिह्नों द्वारा ध्वनि या आशय को लिखित रूप में व्यक्त करने की विशिष्ट पद्धति;बारा राशींपैकी पाचवी रास ज्यात मघा, पूर्वा फाल्गुनी नक्षत्राचे चार चरण व उत्तरा फाल्गुनीचे प्रथम चरण आहे; हिन्दी देवनागरी लिपि में लिखी जाती है; ह्यावेळी सूर्य सिंह राशीत आहे.
260;360;स्वर;कर्क रास;व्याकरण में वह वर्णात्मक शब्द या अक्षर जिसका उच्चारण बिना किसी दूसरे वर्ण की सहायता के और आप-से-आप होता है;बारा राशींपैकी चौथी रास ज्यात पुनर्वसु नक्षत्राचे एक चरण, पुष्य आणि आश्लेषा नक्षत्र असते; हिन्दी में अ,आ,इ,ई आदि स्वर हैं; कर्क राशीचे चिह्न खेकडा आहे.
261;361;व्यंजन;मिथुन रास;वह वर्ण जो बिना स्वर की सहायता के नहीं बोला जा सकता;बारा राशींपैकी तिसरी रास; हिन्दी वर्णमाला में क से लेकर ह तक के सभी वर्ण व्यंजन कहलाते हैं; हे वर्ष मिथुन राशींच्या लोकांसाठी अनुकूल आहे.
262;362;संयुक्ताक्षर;वृषभ रास;वे अक्षर जो आपस में संयुक्त हों;बारा राशींपैकी दुसरी रास ज्यात एकशे एक्केचाळीस तारे आहेत, तसेच कृत्तिकाचे अंतिम तीन चरण, संपूर्ण रोहिणी आणि मृगशीर्षचे पहिले दोन चरण आहेत; मेरा नाम संयुक्ताक्षर में लिखा जाता है; वृषभ राशीचे चिह्न बैल आहे.
263;363;उपास्थि;मेष;एक नीले-सफेद अथवा भूरे रंग का अर्द्धपारदर्शक तंतुमय संयोजी ऊतक;बारा राशींपैकी पहिली रास ज्यात सहासष्ट तारे अशाप्रकारे आहे ज्याच्या संयोगाने मेंढाची आकृती बनते; उपास्थियाँ तीन प्रकार की होती हैं; त्याची रास मेष आहे.
264;364;चित्रलिपि;प्रमाणित;लिपि का वह प्रकार जिसमें किसी वस्तु या भाव का सूचक चित्र-सा बना दिया जाता है;प्रमाणीकरण केलेला; चीन की प्राचीन लिपियाँ चित्रलिपि के उदाहरण हैं; सभेच्या अध्यक्षांनी ठरावाची प्रमाणित प्रत दिली पाहिजे.
265;365;असमतल;सही न केलेला;जो समतल न हो;ज्यावर सही केलेली नाही असा; वह खेती करने के लिए असमतल भूमि को समतल कर रहा है; हा सही न केलेला अर्ज कार्यालयात चालणार नाही.
266;366;अंगूरी;आंबट;अंगूर का बना हुआ;जास्त आंबट असल्यामुळे कोणतीही वस्तू चावून न शकणारा (दात); वह अंगूरी शराब पी रहा है; चिंच खाण्याने माझे दात आंबट झाले आहेत.
267;367;कूल्हा;null;कमर के नीचे तथा जंघाओं के ऊपर के दोनों पार्श्व भागों में निकली हड्डियाँ;null; दुर्घटना के दौरान उसका कूल्हा क्षतिग्रस्त हो गया;null
268;368;रीढ़ की हड्डी;हत्तीशाळा;मनुष्यों और बहुत से जीव-जंतुओं में पीठ के बीच की लम्बी खड़ी हड्डी जिसमें गरदन से लेकर कमर पर की त्रिकास्थि तक माला की तरह गुथी हुई कशेरुकाएँ होती हैं;हत्तीच्या राहण्याचे घर; रीढ़ की हड्डी को सीधी रखने के लिए सीधे बैठें; आमच्या हत्तीशाळेत 10 हत्ती आहेत
269;369;शक्ति;टोक;कोई ऐसा तत्व जो कोई कार्य करता, कराता या क्रियात्मक रूप में अपना प्रभाव दिखलाता हो;बारीक व तीक्ष्ण अग्रभाग; इस कार्य के दौरान आपकी शक्ति का पता चल जायेगा; सुईच्या टोकावर मावेल इतकी जमीनही दुर्योधन पांडवांना द्यायला तयार नव्हता.
270;370;मुँह;बासरी;वह अंग जिससे प्राणी बोलते और भोजन करते हैं;सामान्यतः वेळूपासून तयार केले जाणारे, फुंकून वाजवायचे एक वाद्य; वह इतना डर गया था कि उसके मुँह से आवाज़ ही नहीं निकल रही थी; श्रीकृष्णाच्या बासरीच्या नादाने सर्व गोपाळ तल्लीन झाले
271;371;दाँत;गळदांडी;जीवों के मुँह में अंकुर के रूप में निकली हुई हड्डियों के नीचे-ऊपर की पंक्तियों में से प्रत्येक जिनसे वे कुछ खाते, किसी चीज़ को काटते या ज़मीन आदि खोदते हैं;धातू किंवा लाकडाच्या सळीला दोरा बांधून त्याच्या टोकाला आकडा लावलेले मासे पकडण्याचे साधन; दुर्घटना में उसने अपने कई दाँत खो दिए; मासा पकडताना त्याचा गळ तुटला
272;372;तालु;गज;मुँह के अंदर का ऊपरी अंग या भाग जिसके नीचे जीभ रहती है;धातूचा लांब आणि दंडगोलाकार तुकडा; राम के तालु में सूजन आ गई है; इथे ठेवलेल्या गजाला गंज लागला आहे.
273;373;मसूढ़ा;जवळ;मुँह के अंदर का वह अंग जिसमें दाँत उगे रहते हैं;कमी अंतरावर; राम के मसूढ़े में सूजन है; इथून आमची शाळा जवळच आहे.
274;374;प्रश्नचिन्ह;इतरत्र;वह विराम चिह्न जो छपाई, लेखन आदि में प्रश्नात्मक वाक्यों के अन्त में लगाया जाता है;अन्य ठिकाणी; जहाँ पूर्ण विराम चिह्न लगाना चाहिए, वहाँ आपने प्रश्नचिह्न लगा दिया है; दंगलग्रस्तांचे सामान इतरत्र हलवले
275;375;विराम चिह्न;उत्थान;लेख, छापे आदि में प्रयुक्त होनेवाले वे विशिष्ट चिह्न जो कई प्रकार के विरामों के सूचक होते हैं;उभे राहणे, उठणे; व्याकरण में विराम चिह्नों का बड़ा महत्व है; सुधारकांनी स्त्रियांच्या उत्थानासाठी आपले आयुष्य वेचले
276;376;सही का चिह्न;पूर्णविराम;सही का चिह्न;वाक्याच्या शेवटी येणारे, वाक्यसमाप्तिसूचक विरामचिन्ह; जो वाक्य ठीक हो उसके आगे सही का चिह्न लगाओ; भरीव गोल बिंदू मराठीत पूर्णविराम दर्शवतो
277;377;गलत चिह्न;अर्धविराम;वह चिह्न जो गलत का सूचक हो;दोन वेगवेगळ्या पोटवाक्यांना जोडणारे विरामचिन्ह; जो वाक्य सही न हो उसके आगे गलत चिह्न लगाओ; वाक्य लिहिताना अर्धविराम द्यायचा राहून गेल्याने वाक्य संदिग्ध झाले
278;378;हीरा;स्वल्पविराम;एक बहुमूल्य रत्न जो चमकीला और बहुत कठोर होता है;वाक्यात थोडासा विराम दाखवण्यासाठी किंवा वाक्याचे अवयव वेगळे करून दाखवण्यासाठी वापरण्यात येणारे विरामचिन्ह; हीरे जड़ित आभूषण बहुत महँगे होते हैं; कधीकधी स्वल्पविरामाची जागा बदलली की वाक्याचा अर्थ पालटतो
279;379;ईश्वर प्रेम;उद्गारचिन्ह;वह प्रेम जो ईश्वर के प्रति हो;आश्चर्य, आनंद, दुःख इत्यादी भावना दर्शवणारे चिन्ह; सच्चे आनन्द की अनुभूति ईश्वर प्रेम से ही संभव है;  ही खूण उद्गारचिन्ह म्हणून वापरतात
280;380;अंधभक्ति;संयोगचिन्ह;ऐसी भक्ति जो किसी के प्रति उसके अवगुणों को नजरअंदाज करते हुए पूर्ण रूप से समर्पित हो;दोन शब्दांना जोडणारे चिन्ह; किसी के प्रति अंधभक्ति नहीं होनी चाहिए; जोड-पत्र या शब्दात संयोगचिन्ह वापरले आहे
281;381;नवधा भक्ति;अवतरणचिन्ह;धार्मिक ग्रंथों में मान्य भक्ति के नौ प्रकार;ग्रंथातील किंवा भाषणातील उतारा दाखवताना वापरण्यात येणारी प्रारंभी उलट व शेवटी सुलट्या आकाराच्या खुणेची जोडी; कलियुग में नवधा भक्ति के अंतर्गत कीर्तन का बड़ा महत्व है; भाषणातील मूळ उतारे अवतरणचिन्हात दाखवले आहेत
282;382;रंग;कंस;वह पदार्थ जिससे कोई चीज़ रंगी जाती है;लेखनात काही विशेष गोष्ट सुचवण्यासाठी वापरली जाणारी ( ), {}, [ ] या प्रकारची चिन्हांची जोडी; यह साड़ी लाल रंग से रंगी गई है; ( ) या कंसाला गोल कंस, {} याला महिरपी कंस आणि [ ] याला चौकटीचा कंस म्हणतात
283;383;null;चौकटी कंस;null;एकात एक कंस असताना सर्वात बाहेर वापरली जाणारा कंसाची जोडी;null; [ ] ह्या खूणेची जोडी म्हणजे चौकटी कंस
284;384;अक्षयतृतीया;भिंगरी;वैशाख महीने के शुक्ल पक्ष की तीसरी तिथि;मधे अरी असणारे आणि कोकाटीप्रमाणे फिरवले जाणारे एक खेळणे; अक्षयतृतीया को वट के पूजन का विधान है; राजू भिंगरी फिरवत बसला आहे
285;385;तीव्रानुभूति;पतन;तीव्रता के साथ होने वाली अनुभूति;उच्च प्रदेशाकडून नीच प्रदेशाकडे जाण्याची क्रिया; संतों को ईश्वर प्रेम की तीव्रानुभूति होती है  /  दर्द की तीव्र अनुभूति होते ही वह चिल्लाने लगा; भोगविलासिता हे होळकर साम्राज्याच्या पतनाचे कारण ठरले
