1;101;अजन्मा;भोगणारा;जिसने जन्म न लिया हो;ज्याने भोगले आहे अथवा भोगणारा; देवकी के अजन्मे बालकों के विषय में भविष्यवाणी हुई थी; आजकाल रेल्वे आरक्षण मिळणे किती कठीण आहे हे फक्त भोगणारा व्यक्तीच जाणू शकतो.
2;102;अशुभ;अभोगी;जो शुभ न हो;भोगी नसलेला; बिल्ली के द्वारा रास्ता काटा जाना अशुभ माना जाता है; श्याम अजूनपर्यंत अभोगी आहे एकदा प्रसंग ओढावला की परिस्थितीचे गांभीर्य त्याच्या लक्षात येईल.
3;103;अप्रविष्ट;अनुभूती;जो प्रविष्ट न हुआ हो;मूल्ययुक्त, सकारात्मक आणि अनुभव घेणार्या व्यक्तीचे ज्यावर नियंत्रण नाही असा अनुभव; अप्रविष्ट अतिथियों को शीघ्र ही भीतर प्रवेश करने दिया जाय; सत्याची अनुभूती यावी लागते.
4;104;पवित्र स्थान;भाव;वह स्थान जो पवित्र माना जाता हो;मनात उत्पन्न होणारा विकार; हिंदुओं के लिए काशी एक पवित्र स्थान है; त्याच्या मनात कोणाही विषयी वाईट भाव येत नाही./ प्रीती, द्वेष, भय, क्रोध इत्यादी हे मनोविकार आहेत.
5;105;शिवालय;परवानगी;वह मंदिर जिसमें भगवान शिव की मूर्ति स्थापित की गई हो और जहाँ शिव की आराधना की जाती हो;एखादी गोष्ट करण्यासाठी अधिकारी व्यक्तीने दिलेला होकार; वह प्रत्येक सोमवार को शिवालय जाता है; आईवडिलांनी मला सहलीला जाण्याची परवानगी दिली.
6;106;अपवित्र स्थान;मंजुरी;वह स्थान जो पवित्र न हो;स्वीकार करण्याची क्रिया वा भाव; धार्मिक मान्यता है कि भूत-प्रेत अपवित्र स्थानों पर ही निवास करते हैं; सरकारने ह्या योजनेला मंजुरी दिली.
7;107;आगत;अनुमान;जो आया हुआ हो;एखाद्या गोष्टीविषयीचे अनिश्चित विधान; आगत व्यक्तियों का स्वागत करो; तो यंदा पहिला येईल असे माझे अनुमान आहे.
8;108;जन्मा;कल्पना;जो पैदा हुआ हो या जिसने जन्म लिया हो;मनात रेखाटलेले चित्र; जन्मे प्राणियों की मृत्यु निश्चित है; रामाबद्दल माझी कल्पना फार वेगळी होती
9;109;नैतिक कार्य;अनुमोदन;ऐसा कार्य जो नीतिपरक हो;एखाद्या विधानाला, प्रस्तावाला दिलेली मान्यता; नैतिक कार्यों के द्वारा ही हम समाज का उत्थान कर सकते हैं; सर्वांचे अनुमोदन मिळाल्यामुळे त्याची उमेदवारी नक्की झाली./ जगभरचे शिक्षणतज्ञ आणि बालमानसशास्त्रज्ञ मुलाच्या बौद्धिक विकासासाठी मातृभाषेतून शिक्षणाचा पुरस्कार करतात .
10;110;उत्पन्न;अनुमोदन;जिसकी उत्पत्ति हुई हो या जो उगा हो;एखादी सूचना किंवा गोष्टी ह्यांबाबत दर्शविलेली संमती; भारत में उत्पन्न चाय अधिक मात्रा में विदेशों को निर्यात की जाती है; माझ्या वक्तव्याला त्याने दिलेले अनुमोदन खोटे होते.
11;111;दुश्चरित्रता;प्रतिरोध;दुश्चरित्र होने की अवस्था या भाव;कोणतीही क्रिया थांबवण्याकरता त्याविरुद्ध केलेली क्रिया; दुश्चरित्रता से बचना चाहिए; मुखविवरात श्वासाला होणारा प्रतिरोध ध्वनी निर्माण करतो.
12;112;हेकड़ी;उभयचर;हेकड़ या अक्खड़ होने का भाव;पाण्यात आणि जमिनीवर किंवा हवेत अशा दोन्ही ठिकाणी वावरू शकणारा; श्याम के पिता पुलिस में हैं इसलिए वह हेकड़ी दिखाता है; बेडूक हा उभयचर प्राणी आहे
13;113;अत्याचार;आसक्त;दूसरों के साथ बलपूर्वक किया जानेवाला वह अनुचित व्यवहार जिससे उन्हें बहुत कष्ट हो;एखाद्या गोष्टीविषयीचे अत्याधिक आकर्षण असलेला; भारतीय जनता पर अँग्रेज़ों ने बहुत ही अत्याचार किए; मेनकेवर आसक्त विश्वामित्राची तपश्चर्या भंगली
14;114;घोटाला;निष्ठावंत;जान-बूझकर या मनमाने ढंग से उत्पन्न की जाने वाली अथवा अपटुता के कारण होने वाली गड़बड़ी;एखाद्याविषयी निष्ठा, श्रद्धा किंवा भक्ती असणारा; आजकल हर विभाग में कुछ न कुछ घोटाला हो रहा है; निष्ठावंत अनुयायी मिळाल्यामुळे शिवाजी महाराज हिंदवी स्वराज्य स्थापन करु शकले.
15;115;विटामिन;कामसू;प्रायः खाद्य पदार्थों में पाया जानेवाला एक प्रकार का पोषक तत्व;नेहमी काम करणारा; विटामिन छह प्रकार के होते हैं; राजू हा फार कामसू मुलगा आहे.
16;116;सच्चरित्रता;गुप्तदान;अच्छा चरित्र होने की अवस्था या भाव;आपले नाव जाहीर न करता दिलेले दान; सच्चरित्रता मनुष्य को महान् बनाती है; शेट दीनदयाळने गुप्तदानाद्वारे अनेक गरजवंतांची गरज भागवली.
17;117;मनमानी;भक्ती;किसी के न चाहते हुए भी अपनी इच्छानुसार कोई काम आदि करने या कराने की क्रिया ;देवदेवतांविषयी किंवा ईश्वराविषयी असणारे प्रेम; तुम्हारी मनमानी यहाँ नहीं चलेगी; नामदेवांच्या भक्तीमुळे विठ्ठलाने नैवेद्य खाल्ला
18;118;दुष्कर्म;अनेक;ऐसा कार्य जो नीति के विरुद्ध हो;संख्येने एकापेक्षा जास्त असणारा; दुष्ट व्यक्ति हमेशा दुष्कर्म में ही लिप्त रहता है; भारतात अनेक भाषा बोलल्या जातात.
19;119;अनाज;तेजोवलय;कुछ पौधों से उत्पन्न होने वाले दाने जो खाने के काम में आते हैं;देवता किंवा महापुरुष ह्यांच्या चेहर्यावरील तेज जे चित्रांमध्ये अथवा मूर्तीमध्ये दाखवले जाते; श्याम अनाज का व्यापारी है; सामान्य मनुष्यांचे तेजोवलय क्षीण असल्यामुळे दिसून येत नाही.
20;120;खाद्य वस्तु;प्रेम;खाने (या पीने) के काम आने वाली वस्तु जिससे शरीर को ऊर्जा मिले और शारीरिक विकास हो;एखाद्याला खूप चांगले मानून त्यासोबत किंवा त्याच्याजवळ नेहमी राहण्याची प्रेरणा देणारी मनोवृत्ती; गाँव की अपेक्षा शहरों में खाद्य वस्तुएँ बहुत महँगी हैं; प्रेमात स्वार्थ नसतो./राधा व कृष्णाचे प्रेम सर्वश्रुत आहे
21;121;अनुभवहीन;स्नेह;जिसमें अनुभव की कमी हो या जिसे अच्छा अनुभव या ज्ञान न हो;आपल्यापेक्षा लहान किंवा बरोबरीच्यांबद्दल मनात उमलणारे प्रेम; अनुभवहीन होने के कारण रामू को नौकरी नहीं मिली   /  वह इस खेल में अनुभवहीन है; चाचा नेहरूंना मुलांबद्दल खूपच स्नेह होता.
22;122;अनाड़ी;एकसमान;जो प्रवीण न हो;मूळ रुपासारखे नवे रूप असलेला; अनाड़ी खिलाड़ियों ने भी अच्छे खेल का प्रदर्शन किया; हे दोन्ही खेळणे एकसमान आहेत
23;123;अयोग्य;मते;जो योग्य न हो या जिसमें पात्रता न हो;एखाद्याच्या मताप्रमाणे; प्रबंधक ने अयोग्य व्यक्तियों को संस्था से निकाल दिया; तिच्या मते तिच सर्वश्रेष्ठ आहे
24;124;शेरनी;हिमाचली;मादा शेर;हिमाचल प्रदेशचा किंवा तेथील निवासी, भाषा, संस्कृती इत्यादीशी संबंधित; शेरनी शेर से अधिक खूँखार होती है   /  गुरु भक्त शिवाजी समर्थ गुरु रामदास का पेट दर्द ठीक करने के लिए शेरनी का दूध लाए; त्याच्या डोक्यावर हिमाचली टोपी होती.
25;125;नौसिखिया;आग्रह;जिसने कोई काम अभी हाल में सीखा हो;एखाद्या गोष्टीसाठी विनयाने केलेला हट्ट; यह काम नौसिखिया व्यक्ति भी कर सकता है; मला कुणाचाही आग्रह मोडवत नाही
26;126;फूहड़;मुदतसमाप्ती झालेला;जिसे भली भाँति काम करने का ढंग न आता हो;ज्याच्या उपयोगाची अवधी समाप्त झाली आहे असा; तुम फूहड़ व्यक्तियों जैसा काम क्यों करते हो ?; मुदतसमाप्ती झालेली औषधे घेणे नेहमी टाळावे.
27;127;मूर्ख;प्रार्थना;जिसे बुद्धि न हो या बहुत कम हो या जो मूर्खतापूर्ण आचरण करता हो;एखाद्यास एखादी गोष्ट करण्यासाठी नम्रपणे केले जाणारे निवेदन; मूर्ख लोगों से बहस नहीं करनी चाहिए; अपराध्याने राजाकडे मृत्युदंड रद्द करण्याची प्रार्थना केली.
28;128;अप्रचलित;याचिका;जो प्रचलित न हो;ज्यात काही विनंती केली आहे असा कागद; तुम हमेशा अप्रचलित पहनावा ही क्यों पहनते हो ?; त्याची याचिका न्यायालयात फेटाळली गेली
29;129;प्रवीण;अनुवाद;जो किसी कार्य को करने में विशेष योग्यता रखता हो;एखाद्या भाषेत लिहिलेला किंवा बोललेला मजकूर दुसर्या भाषेत बोलण्याची किंवा लिहिण्याची कार्य; धनुर्विद्या में प्रवीण अर्जुन ने तेल में मछली की परछाईं देखकर उसकी आँख पर निशाना लगाया; रामायणाचे अनुवाद अधिकांश भाषांमध्ये झाले आहे.
30;130;योग्य;अनुवादित रचना;जिसमें किसी काम को अच्छी तरह से करने का हुनर या गुण हो;अनुवाद केलेली रचना; इस काम के लिए एक योग्य व्यक्ति की आवश्यकता है; ही राष्ट्रपतींच्या इंग्रजी पुस्तकाची अनुवादित रचना आहे./अनुवादित रचना समजण्यास सोप्या असतात.
31;131;सभ्य;व्याख्या;उच्च आचार-विचार रखने और भले आदमियों का-सा व्यवहार करने वाला;एखाद्या जटिल वाक्य, शब्द इत्यादीच्या अर्थाचे स्पष्टीकरण; राम एक सभ्य व्यक्ति है; संस्कृत श्लोकांची व्याख्या सर्वांनाच करणे कठीण आहे.
32;132;अच्छा;विनिमय व्यापार;जो भला या अच्छा हो या जिसमें अच्छे गुण हों या जिसके काम आदि से दूसरों का भला हो;एका वस्तूच्या बदल्यात दुसरी वस्तू घेण्याचा किंवा देण्याचा व्यापार; दुनिया में अच्छे लोगों की कमी नहीं है; राम विनिमय व्यापार करतो.
33;133;नरभक्षी;कार्यारंभ;जो मनुष्य का भक्षण करता हो या मानव को अपना आहार बनानेवाला;एखाद्या कार्याची सुरुवात; शिकारी ने नरभक्षी बाघिन को अपना निशाना बनाया; माझे आजोबा कोणतेही कार्यारंभ केले की त्याला पूर्ण करूनच सोडतात./कार्यारंभ करताना गणेशाचे पूजन केले जाते.
34;134;नवरत्न;धार्मिक कृत्य;वे नौ विद्वान जो प्राचीन काल में किसी-किसी राजा-महाराजा की सभा में रहते थे;शास्त्रांत सांगितल्याप्रमाणे केले जाणारे काम; कालिदास विक्रमादित्य के नवरत्नों में से एक थे; बालपणापासून मला संध्या, पूजा इत्यादींसारखे धार्मिक कृत्य शिकवले.
35;135;अनाथ;मंगलोत्सव;जिसका कोई पालन-पोषण करनेवाला न हो;मंगल कार्य इत्यादीं समयी साजरा केला जाणारा उत्सव; श्याम ने अपना सारा जीवन अनाथ बच्चों की परवरिश में बिता दिया; गणेशोत्सवात अख्खी मुंबईच मंगलोत्सव साजरा करण्यासाठी रस्त्यावर उतरते.
36;136;असहाय;यजन;जिसका कोई सहारा न हो;यज्ञ करण्याची क्रिया; सुरेन्द्रजी असहाय व्यक्तियों की सहायता करते रहते हैं; हनुमान मंदिरात यजन सुरू आहे.
37;137;पितृहीन;संकल्प करणे;जिसके पिता न हों;एखादी गोष्ट करण्याचे ठरवणे; पितृहीन बच्चे कभी-कभी दिशाहीन हो जाते हैं; नवीन वर्षात खोटे न बोलण्याचा त्याने संकल्प केला
38;138;साधनहीन;संशोधन;जिसके पास कोई साधन न हो;नवीन शोध लावण्याची क्रिया; सरकार साधनहीन व्यक्तियों के लिए साधन जुटाने का प्रयास कर रही है; वैज्ञानिक संशोधनातून रोबट निर्माण केले आहे. / काही वर्षं केलेल्या संशोधनातून एक कम्प्युटर चिप तयार केली आहे.
39;139;सनाथ;शोध;जिसका कोई पालन-पोषण या देखभाल करने वाला हो;एखादी वस्तू कुठपासून व कशी आहे हे पाहण्यासाठी शोधण्याची क्रिया; सनाथ बालकों को अनाथ बालकों की मदद करनी चाहिए   /  साधक प्रभु का हो जाने पर अनाथ नहीं रहता, सनाथ हो जाता है; कोलंबसने अमेरिकेचा शोध लावला.
40;140;गीदड़ी;अनुकृत;मादा गीदड़;एखाद्या गोष्टीच्या अनुकरणातून तयार झालेला; जंगल में एक गीदड़ी अपने बच्चे को दूध पिला रही थी; ही एक अनुकृत रचना आहे.
41;141;ससहाय;विचार;जिसका कोई सहारा हो;एखाद्या गोष्टीला अनुलक्षून केली जाणारी मानसिक क्रिया; ससहाय व्यक्तियों को दूसरों की सहायता करनी चहिए; मी सध्या या विषयावर विचार करतो आहे
42;142;मातृहीन;घृणा;जिसकी माता न हो;एखादी गोष्ट नकोशी वाटल्यामुळे त्यापासून दूर जाण्याची भावना; सेठजी बचपन में ही मातृहीन हो गए; बीभत्स दृश्यांची मला घृणा येते.
43;143;साधन सम्पन्न;विरक्ती;जिसके पास साधन हो या साधन से संपन्न हो;संसारिक सुख, उपभोग यांपासून मन भरल्यामुळे त्याविषयी ओढ न राहण्याची अवस्था किंवा भाव; साधन संपन्न व्यक्ति समाज के विकास में सहायक होते हैं; त्याला संसाराविषयी विरक्ती आली.
44;144;अपमान;भिन्नरूपी;वह बात या कार्य जिससे किसी का मान या प्रतिष्ठा कम हो;समरूपी नसलेला; हमें किसी का अपमान नहीं करना चाहिए   /  ससुराल में उसकी बड़ी भद्द हुई; ह्या मंदिरात महादेवाच्या भिन्नरूपी प्रतिमा आहेत.
45;145;अशिष्टता;अनुवादित;अशिष्ट होने की अवस्था या भाव;ज्याचा अनुवाद केला आहे असा; अशिष्टता मानव को पशु बना देती है; हा बायबलचा अनुवाद आहे
46;146;सम्मान;मूळ रचना;ऐसी बात या कार्य जिसे किसी के प्रति कहने या करने से उसे प्रसन्नता मिले या सम्मानित होने की अवस्था;एखाद्या रचनेचे अनुवाद,अनुकरण न केलेले किंवा विशिष्ट प्रसंगावर आधारित नसलेली व जी स्वतःच्या कल्पनेतून उद्भवलेली आहे अशी रचना; माता-पिता का सम्मान करना चाहिए; गोदान ही प्रेमचंद ह्यांची मूळ रचना आहे.
