98;198;याद;विदेशी;वह ज्ञान जो स्मरण शक्ति के द्वारा एकत्र या प्राप्त होता है;दुसर्या देशात राहणारा; बचपन की याद आते ही मन प्रसन्न हो जाता है; विदेशी लोकांकरता भारतीय संस्कृती आश्चर्याचा विषय आहे
99;199;ज्ञान;विरोधी पक्षीय;वस्तुओं और विषयों की वह तथ्यपूर्ण, वास्तविक और संगत जानकारी जो अध्ययन, अनुभव, निरीक्षण, प्रयोग आदि के द्वारा मन या विवेक को होती है;विरोधी पक्षाशी संबंधित अथवा विरोधी पक्षाचा; उसे संस्कृत का अच्छा ज्ञान है; आज संध्याकाळी विरोधी पक्षीय नेत्यांची बैठक होणार आहे.
100;200;अनुभवी;अतिथिगृह;अनुभव रखनेवाला या जिसे किसी काम,वस्तु आदि का अनुभव हो;पाहुण्यांना राहायला दिलेली जागा; इस काम के लिए एक अनुभवी व्यक्ति की आवश्यकता है; ताडोबाचे अतिथिगृह फार मोठे आहे
101;201;भुक्तभोगी;जलाशय;जो भोग चुका हो या भुगतने वाला;जिथे पाणी साचलेले असते अशी एखादी जागा; आजकल रेल में आरक्षण मिलना कितना मुश्किल है यह कोई भुक्तभोगी व्यक्ति ही जान सकता है; जलाशयात अनेक रंगांची कमळे फुलली आहेत
102;202;अभुक्तभोगी;null;जो भुक्तभोगी न हो;null; श्याम अभी अभुक्तभोगी है, जब एक बार ठोकर लगेगी तो खुद ही सँभल जायेगा;null
103;203;अनुभूति;ओसरी;ऐसा मानसिक व्यापार जिसकी बाहरी प्रतिक्रिया तो नहीं होती फिर भी जिससे सुख-दुख का अनुभव होता है;घराच्या पुढच्या भागातील दरवाजापुढचे पुढे भिंती नसलेले आणि वर छप्पर असलेले बांधकाम; बेसुध शरीर अनुभूति से शून्य होता है; ओसरीवर बसून पाऊस पाहण्याची आवड मला लहानपणापासून आहे.
104;204;मनोभाव;मुख्य दरवाजा;मन में उत्पन्न होनेवाला भाव या कोई विचार;एखादे भवन इत्यादीचे सर्वांत प्रमुख किंवा बाहेरचे द्वार; मनोभाव पर नियंत्रण करना कठिन होता है   /  मन में तरह-तरह के भाव आते हैं; हा ह्या किल्ल्याचा मुख्य दरवाजा आहे.
105;205;अनुमति;ग्रहदशा;कोई काम करने से पहले उसके संबंध में बड़ों से मिलने या ली जाने वाली स्वीकृति जो बहुत-कुछ आज्ञा के रूप में होती है;मनुष्यादिकास प्राप्त होणारी शुभाशुभ फलसूचक सूर्यादी ग्रहांची दशा; बड़ों की अनुमति के बिना कोई भी काम नहीं करना चाहिए; ग्रहदशा वाईट असल्याने माझी कामे होत नाहीत
106;206;स्वीकृति;राशिचक्र;स्वीकार करने की क्रिया या भाव;क्रांतिवृत्ताच्या दोहीकडे आठ आठ अंशापावेतो विस्तारलेला एक कल्पित कटिबंध ज्यात मुख्य ग्रहांच्या कक्षा सर्वाशीं सापडतील; भारत सरकार ने इस परियोजना को चालू करने के लिए अपनी स्वीकृति दे दी है; राशिचक्रात बारा राशी आहेत
107;207;अनुमान;राशी;अपने मन से यह समझने की क्रिया या भाव कि ऐसा हो सकता है या होगा;नक्षत्रचक्राच्या किंवा क्रांतिवृत्ताच्या कल्पित बारा भागांपैकी कोणताही एक भाग; कभी-कभी अनुमान गलत भी हो जाता है; रामची रास कन्या आहे
108;208;कल्पना;ग्रह;वह शक्ति या भाव जो मन में नयी, अनोखी, अनदेखी,अनसुनी आदि बातों के स्वरूप को उपस्थित करती है;सूर्याभोवती फिरणारा खगोलीय पिंड; मूर्तिकार की कल्पना पत्थर को तराश कर मूर्त रूप प्रदान करती है; पृथ्वी हा एक ग्रह आहे.
109;209;समर्थन;पूजनीय;किसी के किए हुए काम या सामने रखे हुए सुझाव को ठीक मानकर अपनी दी हुई स्वीकृति;पूजा करण्यायोग्य; हम इस प्रस्ताव का अनुमोदन करते हैं; गौतमबुद्ध हे पूजनीय व्यक्ती होते.
110;210;वाहवाही;नमाज;किसी बात,सुझाव आदि पर प्रसन्नता प्रकट करने की क्रिया या भाव;मुसलमानांची ईश्वरप्रार्थना; मेरे वक्तव्य पर उसकी वाहवाही दिखावटी है; मुसलमान लोक दिवसातून पाच वेळा नमाज पढतात
111;211;विरोध;पूजित;किसी कार्य आदि को रोकने के लिए उसके विपरीत कुछ करने की क्रिया या किसी कार्य, जिसे हम न चाहते हों, के विपरीत कुछ करने की क्रिया;ज्याची पूजा केली आहे असा; राम के विरोध के बावज़ूद भी मैंने चुनाव लड़ा; पूजित गणपतीला सर्वांनी नमस्कार केला.
112;212;उभयचर;आईवडील;जो जल और स्थल दोनों पर रह सके;एखाद्या व्यक्तीच्या संदर्भात तिला जन्म देणारे स्त्री आणि पुरुष; मेंढक एक उभयचर प्राणी है; आईवडिलांची सेवा करणे हे आपले कर्तव्य आहे
113;213;आसक्त;समर्थक;किसी के प्रति अत्यधिक अनुरक्त;एखादा पक्ष किंवा प्रस्ताव, ठराव इत्यादीचे समर्थन करणारी व्यक्ती; सांसारिक वस्तुओं के प्रति आसक्त मन क्षणिक सुख पाता है; ते धर्मनिरपेक्षतेचे कडवे समर्थक आहेत.
114;214;निष्ठावान;ताई;किसी के प्रति निष्ठा, श्रद्धा या भक्ति रखने वाला;वयाने मोठी असलेली बहीण; भगवान राम के प्रति निष्ठावान तुलसीदास को कृष्ण की मूर्ति में भी राम ही दिखे; माझी ताई सर्वांची फार काळजी घेते
115;215;नौकरीशुदा;सोन्याची खाण;काम या उद्यम में लगा रहनेवाला;ज्यामध्ये सोने सापडते ती खाण; मेरी माँ एक नौकरीशुदा महिला हैं; कर्नाटकात अनेक सोन्याच्या खाणी आहेत
116;216;गुप्तदान;लोह भांडार;गुप्त रूप से किया हुआ दान;लोहचे भांडार; सेठ दीनदयालजी गुप्तदान के द्वारा ही दूसरों की आवश्यकताओं की पूर्ति करते हैं; ह्या क्षेत्रात भरपूर लोह भांडार आहे.
117;217;भक्ति;लोखंड;देवी-देवता या ईश्वर के प्रति होने वाला विशेष प्रेम;काळ्या रंगाचा एक धातू ज्यापासून भांडी, यंत्र, हत्यार इत्यादी बनविले जाते; ईश्वर के प्रति भक्ति होनी चाहिए; लोखंड हे माणसाला खूप उपयोगी आहे.
118;218;अनेक;प्रतिपक्षी;एक से अधिक;जो विरोधी पक्षात आहे तो; भारत में अनेक भाषाएँ बोली जाती हैं   /  बहुभाषी होने के अनेक फायदे हैं; संसदेत प्रतिपक्षी जमले होते.
119;219;प्रभामंडल;सूर्यवंश;देवताओं या दिव्य पुरुषों आदि के मुख के चारों ओर का वह प्रभापूर्ण मंडल जो चित्रों या मूर्तियों में दिखलाया जाता है;सूर्यापासून उत्पन्न झालेले, क्षत्रियांच्या दोन प्रसिद्ध कुळांपैकी एक कूळ; साधारण मनुष्यों के प्रभामंडल की दीप्ति क्षीण होने के कारण दिखाई नहीं पड़ती है; रामाचा जन्म सूर्यवंशात झाला होता
120;220;प्रेम;चंद्रवंश;वह मनोवृत्ति जो किसी काम, चीज, बात या व्यक्ति को बहुत अच्छा, प्रशंसनीय तथा सुखद समझकर सदा उसके साथ अपना घनिष्ठ संबंध बनाये रखना चाहती है या उसके पास रहने की प्रेरणा देती है;चंद्रापासून उत्पन्न झालेले, क्षत्रियांच्या दोन प्रसिद्ध कुळांपैकी एक; प्रेम में स्वार्थ का कोई स्थान नहीं होता  / उसे संगीत से अनुराग है; चंद्रवंशात अनेक पराक्रमी राजे झाले
121;221;स्नेह;सज्जन;अपने से छोटों, हमजोलियों आदि के प्रति हृदय में उठने वाला प्रेम;चांगल्या स्वभावाची व्यक्ती; चाचा नेहरू को बच्चों से बहुत स्नेह था; सज्जन सर्वांना आपलेसे करतात
122;222;प्रतिरूपी;दुर्जन;जो किसी का प्रतिरूप हो या जो रूप, आकार आदि में एक जैसा हो;दुष्ट व्यक्ती; उसने तीन प्रतिरूपी मूर्तियाँ खरीदी; दुर्जन कधीच कुणाचे भले करत नाहीत
123;223;अनुसार;नाव;के मत से या की दृष्टि से;एखाद्या वस्तू किंवा व्यक्तीला ओळखण्यासाठी दिला गेलेला एक विशिष्ट शब्द; वह मेरे अनुसार काम करना नहीं चाहता; माझ्या भावाचे नाव तुषार आहे
124;224;फालसई;उपाधी;फालसे के फल के रंग का;नावासोबत लावला जाणारा योग्यता,सम्मान इत्यादींसाठी वापरला जाणारा सुचक शब्द; मीरा ने फालसई साड़ी पहनी हुई है; श्यामला डॉक्टरेटची उपाधी मिळाली
125;225;अनुरोध;बुध;किसी बात के लिए विनयपूर्वक किया जानेवाला हठ;सूर्याच्या सर्वात जवळ असलेला सूर्यमालेतील पहिला ग्रह; किसी के अनुरोध को ठुकराना अच्छी बात नहीं; बुधाला नैसर्गिक उपग्रह नाहीत
126;226;गतावधिक;शुक्र;जिसके उपयोग की अवधि समाप्त हो चुकी हो;बुध व पृथ्वीच्या मधील सूर्यमालेतील एक ग्रह; गतावधिक दवाओं का उपयोग नहीं करना चाहिए; सकाळी व संध्याकाळी आकाशात शुक्र दिसतो
127;227;प्रार्थना;गुरू;किसी से कुछ करने के लिए नम्रतापूर्वक कहने की क्रिया;सूर्यमालेतील पाचवा, सर्वात मोठा ग्रह; चपरासी ने अधिकारी से छुट्टी के लिए प्रार्थना की; सर्व ग्रहांत गुरू हा सर्वात मोठा ग्रह आहे./ गुरू सर्वात वेगाने परिभ्रमण करतो.
128;228;याचिका;शनी;वह पत्र जिसमें किसी से कुछ याचना की गई हो;सूर्यमालेतील सहावा ग्रह; उसकी याचिका न्यायालय द्वारा खारिज़ कर दी गई; शनीला अठरा चंद्र आहेत./शनी हा पृथ्वीपासून खूप दूर आहे.
129;229;अनुवाद;नेपच्यून;एक भाषा में लिखी हुई चीज़ या कही हुई बात को दूसरी भाषा में लिखने या कहने का कार्य;सूर्यमालेतील आठवा ग्रह; उसने अनुवाद को अपना पेशा बनाया है; सूर्याभोवती फेरी पूर्ण करायला नेपच्यूनला 165 वर्षे लागतात
130;230;अनुवादित कृति;प्लूटो;अनुवाद की हुई कृति;सूर्यमालेतील ज्ञात असा सर्वात दूरचा ग्रह; यह राष्ट्रपति की अंग्रेज़ी पुस्तक की अनुवादित कृति है; प्लूटोचा शोध  मध्ये लागला.
131;231;व्याख्या;राज्य;किसी जटिल वाक्य आदि के अर्थ का स्पष्टीकरण;विशिष्ट अशा मर्यादांनी निश्चित केलेला व ज्यात राहणार्या लोकांची भाषा, राहणीमान इत्यादी दुसर्या भागाच्या लोकांपेक्षा वेगळी असते असा देशाचा एक भाग; संस्कृत श्लोकों की व्याख्या सबके बस की बात नहीं है; प्रत्येक प्रदेशाच्या लोकांची राहणी वेगवेगळी असते
132;232;विनिमय व्यापार;विभाग;ऐसा व्यापार जिसमें एक वस्तु के बदले दूसरी वस्तु दी जाती है या वस्तुओं का लेन-देन किया जाता है;अनेक जिल्हे मिळून बनलेला राज्याचा एक भाग; राम विनिमय व्यापार करता है; तो दहावीत मुंबई विभागातून प्रथम आला
133;233;कार्य आरंभ;जिल्हा;किसी कार्य के आरंभ होने की क्रिया;अनेक तालुके मिळून बनलेला राज्याचा एक भाग; मेरे दादाजी कार्य आरंभ से पहले गणेष जी की पूजा करते हैं; आमचे गाव इंदौर जिल्ह्यात येते
134;234;धर्म-कर्म;ओरडणे;ऐसे कर्म जो धर्म से संबंधित हों;संकटाच्या वेळी किंवा रागावून जोरात बोलणे; महात्मा लोग धर्म-कर्म में लीन हैं; समोर वाघ पाहून शेतकरी ओरडला
135;235;मंगलोत्सव;रडणे;वह उत्सव जो मंगल कार्य आदि के दौरान किया जाता है;दुःख झाल्याने डोळ्यातून पाणी काढणे; बेटे के जन्मदिवस पर उसने मंगलोत्सव का आयोजन किया; आपल्या आईपासून दूर झाल्यामुळे श्याम रडत होता
136;236;यजन;गाणे;यज्ञ करने की क्रिया;ताल व स्वरांच्या नियमानुसार कंठातून ध्वनी काढणे; हनुमान मंदिर में यजन शुरू है; स्पर्धेत एक लहान मुलगी छान गायली
137;237;संकल्पन;कण्हणे;संकल्प करने की क्रिया या भाव;वेदना सहन न झाल्यामुळे तोंडातून आपोआप बारीक आवाज येणे; संकल्पन के बाद वह दूने उत्साह से अपने कार्य में लग गया; पोटाच्या असह्य दुखण्यामुळे तो कण्हत होता
138;238;अनुसंधान;मुसमुसणे;किसी विषय का अच्छी तरह अनुशीलन करके उसके संबंध में नई बातों या तथ्यों का पता लगाने की क्रिया;हळूहळू रडणे; रोबोट वैज्ञानिक अनुसंधान की देन है; आपले दुःख कुणाला सांगता न आल्यामुळे ती एकटीच मुसमुसत होती
139;239;खोज;पाणी येणे;कोई चीज़ पाने या देखने के लिए पता लगाने की क्रिया कि वह कहाँ है और कैसी है;डोळ्यात पाणी येणे; कोलम्बस ने अमेरिका की खोज की; कांदा कापताना डोळ्यातून पाणी येते.
140;240;अनुकृत;विलाप करणे;किसी के अनुकरण पर बनाया गया;मोठ्याने रडून दुःख व्यक्त करणे; यह एक अनुकृत रचना है; दुर्योधनाच्या मृत्यूची वार्ता ऐकून गांधारीने विलाप केला
141;241;चिंतन;तालुका;विचार करने की क्रिया या भाव;राज्यकारभाराच्या दृष्टीने केलेल्या  जिल्ह्याचा एक विभाग; बहुत चिंतन के बाद हमने समस्या का हल ढूँढ़ निकाला; तालुकदार हा तालुक्याचा आधिकारी असतो
142;242;घृणा;वादविवाद करणे;वह मनोवृत्ति जो किसी को बहुत बुरा समझकर सदा उससे दूर रहने की प्रेरणा देती है;एखाद्या विषयाच्या साधकबाधक मुद्यावर बोलणे किंवा आपले मत मांडणे; जहाँ घृणा होती है वहाँ दया का अभाव होता हैं   /  उसने मुझे हक़ारत भरी नज़र से देखा; बराच वादविवाद करून शेवटी त्याने माझे मत मान्य केले
143;243;विरक्ति;वितंडवाद करणे;सांसारिक सुख-भोगों से मन भर जाने के कारण उनकी ओर प्रवृत्ति न रह जाने की अवस्था या भाव;अट्टहासाने खोटा पक्ष स्थापन करण्यासाठी वादविवाद करणे; विरक्ति मनुष्य को निर्भय बनाती है   /  मन उचाट हो गया है; उगाचच माझ्याशी वितंडवाद घालू नकोस
144;244;भिन्नरूपी;धमकावणे;जो प्रतिरूपी न हो;एखादी संभाव्य वाईट गोष्ट होण्यापूर्वी सूचना देऊन घाबरवणे; इस मंदिर में शिव की भिन्नरूपी प्रतिमाएँ हैं; काल त्याला काही गुंडांनी वाटेत गाठून धमकावले
